{
  "build": {
    "binary": "hip/build/fused_peps_gfx1201_db18b55d",
    "binary_name": "fused_peps_gfx1201_db18b55d",
    "binary_sha256": "5bb1652b1fedd7f466c4451d89a9c865e18fd1447bb1febfbd0f16732af57191",
    "code_object_inspection": "1       host-x86_64-unknown-linux-gnu-                                      file:///home/aup/yy/workspace/peps/hip/build/fused_peps_gfx1201_db18b55d#offset=16384&size=0\n1       hipv4-amdgcn-amd-amdhsa--gfx1201                                    file:///home/aup/yy/workspace/peps/hip/build/fused_peps_gfx1201_db18b55d#offset=16384&size=44696",
    "code_object_inspector": "/usr/bin/roc-obj-ls",
    "code_object_targets": [
      "gfx1201"
    ],
    "command": [
      "/opt/rocm/bin/amdclang++",
      "-x",
      "hip",
      "-O3",
      "-DNDEBUG",
      "--offload-arch=gfx1201",
      "-DPEPS_GIT_SHA=\"db18b55d\"",
      "-DPEPS_TARGET_ISA=\"gfx1201\"",
      "/home/aup/yy/workspace/peps/hip/fused_peps_kernel.hip",
      "-L/opt/rocm/lib",
      "-lamdhip64",
      "-o",
      "/home/aup/yy/workspace/peps/hip/build/fused_peps_gfx1201_db18b55d"
    ],
    "compile_stderr": "",
    "compile_stdout": "",
    "compiler": "/opt/rocm/bin/amdclang++",
    "compiler_version": "AMD clang version 22.0.0git (https://github.com/RadeonOpenCompute/llvm-project roc-7.2.3 26084 f58b06dce1f9c15707c5f808fd002e18c2accf7e)\nTarget: x86_64-unknown-linux-gnu\nThread model: posix\nInstalledDir: /opt/rocm-7.2.3/lib/llvm/bin\nConfiguration file: /opt/rocm-7.2.3/lib/llvm/bin/clang++.cfg",
    "git_dirty": true,
    "git_head": "db18b55d06f7ebd4e476a42bc88828ca5916e398",
    "git_sha": "db18b55d",
    "source_sha256": "64d6e66700bb6a595f512d763159b63964fe7e139dc596b662be7543e0b5b61a",
    "target_isa": "gfx1201"
  },
  "generated_at": "2026-07-21T18:17:58.094696+00:00",
  "hardware": {
    "detected_isa": "gfx1201",
    "device_index": 0,
    "hostname": "aup-WRX90-WS-EVO",
    "platform": "Linux-6.14.0-27-generic-x86_64-with-glibc2.39",
    "power_clock_after": {
      "card0": {
        "Average Graphics Package Power (W)": "6.0",
        "Card SKU": "APM107573",
        "Card model": "0x5413",
        "Card series": "0x7551",
        "Card vendor": "Advanced Micro Devices, Inc. [AMD/ATI]",
        "dcefclk clock level:": "1",
        "dcefclk clock speed:": "(219Mhz)",
        "fclk clock level:": "1",
        "fclk clock speed:": "(582Mhz)",
        "mclk clock level:": "0",
        "mclk clock speed:": "(96Mhz)",
        "pcie clock level": "1 (32.0GT/s x16)",
        "sclk clock level:": "1",
        "sclk clock speed:": "(0Mhz)",
        "socclk clock level:": "0",
        "socclk clock speed:": "(417Mhz)"
      },
      "card1": {
        "Average Graphics Package Power (W)": "7.0",
        "Card SKU": "APM107573",
        "Card model": "0x5413",
        "Card series": "0x7551",
        "Card vendor": "Advanced Micro Devices, Inc. [AMD/ATI]",
        "dcefclk clock level:": "1",
        "dcefclk clock speed:": "(219Mhz)",
        "fclk clock level:": "1",
        "fclk clock speed:": "(582Mhz)",
        "mclk clock level:": "0",
        "mclk clock speed:": "(96Mhz)",
        "pcie clock level": "1 (32.0GT/s x16)",
        "sclk clock level:": "1",
        "sclk clock speed:": "(3Mhz)",
        "socclk clock level:": "0",
        "socclk clock speed:": "(417Mhz)"
      },
      "card2": {
        "Average Graphics Package Power (W)": "9.0",
        "Card SKU": "APM107573",
        "Card model": "0x5413",
        "Card series": "0x7551",
        "Card vendor": "Advanced Micro Devices, Inc. [AMD/ATI]",
        "dcefclk clock level:": "1",
        "dcefclk clock speed:": "(219Mhz)",
        "fclk clock level:": "1",
        "fclk clock speed:": "(582Mhz)",
        "mclk clock level:": "0",
        "mclk clock speed:": "(96Mhz)",
        "pcie clock level": "1 (32.0GT/s x16)",
        "sclk clock level:": "1",
        "sclk clock speed:": "(5Mhz)",
        "socclk clock level:": "0",
        "socclk clock speed:": "(417Mhz)"
      },
      "card3": {
        "Average Graphics Package Power (W)": "13.0",
        "Card SKU": "APM107573",
        "Card model": "0x5413",
        "Card series": "0x7551",
        "Card vendor": "Advanced Micro Devices, Inc. [AMD/ATI]",
        "dcefclk clock level:": "1",
        "dcefclk clock speed:": "(219Mhz)",
        "fclk clock level:": "1",
        "fclk clock speed:": "(582Mhz)",
        "mclk clock level:": "0",
        "mclk clock speed:": "(96Mhz)",
        "pcie clock level": "1 (32.0GT/s x16)",
        "sclk clock level:": "1",
        "sclk clock speed:": "(12Mhz)",
        "socclk clock level:": "0",
        "socclk clock speed:": "(417Mhz)"
      },
      "system": {
        "Driver version": "6.14.0-27-generic"
      }
    },
    "power_clock_before": {
      "card0": {
        "Average Graphics Package Power (W)": "21.0",
        "Card SKU": "APM107573",
        "Card model": "0x5413",
        "Card series": "0x7551",
        "Card vendor": "Advanced Micro Devices, Inc. [AMD/ATI]",
        "dcefclk clock level:": "1",
        "dcefclk clock speed:": "(219Mhz)",
        "fclk clock level:": "1",
        "fclk clock speed:": "(1020Mhz)",
        "mclk clock level:": "1",
        "mclk clock speed:": "(456Mhz)",
        "pcie clock level": "1 (32.0GT/s x16)",
        "sclk clock level:": "1",
        "sclk clock speed:": "(1046Mhz)",
        "socclk clock level:": "1",
        "socclk clock speed:": "(480Mhz)"
      },
      "card1": {
        "Average Graphics Package Power (W)": "8.0",
        "Card SKU": "APM107573",
        "Card model": "0x5413",
        "Card series": "0x7551",
        "Card vendor": "Advanced Micro Devices, Inc. [AMD/ATI]",
        "dcefclk clock level:": "1",
        "dcefclk clock speed:": "(219Mhz)",
        "fclk clock level:": "1",
        "fclk clock speed:": "(582Mhz)",
        "mclk clock level:": "0",
        "mclk clock speed:": "(96Mhz)",
        "pcie clock level": "1 (32.0GT/s x16)",
        "sclk clock level:": "1",
        "sclk clock speed:": "(34Mhz)",
        "socclk clock level:": "0",
        "socclk clock speed:": "(417Mhz)"
      },
      "card2": {
        "Average Graphics Package Power (W)": "11.0",
        "Card SKU": "APM107573",
        "Card model": "0x5413",
        "Card series": "0x7551",
        "Card vendor": "Advanced Micro Devices, Inc. [AMD/ATI]",
        "dcefclk clock level:": "1",
        "dcefclk clock speed:": "(219Mhz)",
        "fclk clock level:": "1",
        "fclk clock speed:": "(582Mhz)",
        "mclk clock level:": "0",
        "mclk clock speed:": "(96Mhz)",
        "pcie clock level": "1 (32.0GT/s x16)",
        "sclk clock level:": "1",
        "sclk clock speed:": "(28Mhz)",
        "socclk clock level:": "0",
        "socclk clock speed:": "(417Mhz)"
      },
      "card3": {
        "Average Graphics Package Power (W)": "14.0",
        "Card SKU": "APM107573",
        "Card model": "0x5413",
        "Card series": "0x7551",
        "Card vendor": "Advanced Micro Devices, Inc. [AMD/ATI]",
        "dcefclk clock level:": "1",
        "dcefclk clock speed:": "(219Mhz)",
        "fclk clock level:": "1",
        "fclk clock speed:": "(582Mhz)",
        "mclk clock level:": "0",
        "mclk clock speed:": "(96Mhz)",
        "pcie clock level": "1 (32.0GT/s x16)",
        "sclk clock level:": "1",
        "sclk clock speed:": "(22Mhz)",
        "socclk clock level:": "0",
        "socclk clock speed:": "(417Mhz)"
      },
      "system": {
        "Driver version": "6.14.0-27-generic"
      }
    },
    "rocm_version": "7.2.3"
  },
  "measurements": [
    {
      "activation": "gelu",
      "benchmark_kind": "integrated_paper_workload",
      "checksum": -0.0062618833,
      "comparable_to_paper": false,
      "compiled_target": "gfx1201",
      "compute_units": 32,
      "driver_version": 70253211,
      "feature_dim": 16,
      "git_sha": "db18b55d",
      "gpu_name": "AMD Radeon Graphics",
      "grid_height": 1024,
      "grid_width": 1024,
      "hidden_dim": 64,
      "hidden_layers": 3,
      "implementation": "fused_rocwmma_fp16",
      "isa": "gfx1201",
      "iters": 100,
      "max_ms": 42.851562,
      "mean_ms": 27.078659,
      "median_ms": 42.304207,
      "method": "bi-grid",
      "min_ms": 7.295043,
      "mode": "baseline",
      "num_frequencies": 0,
      "out_dim": 3,
      "output_height": 1024,
      "output_width": 1024,
      "p95_ms": 42.77364,
      "paper_reference_ms": 4.32,
      "paper_reference_source": "arXiv:2604.24167v1",
      "precision": "fp16_fp32_accumulate",
      "runtime_version": 70253211,
      "schema_version": 3,
      "selected_feature_dim": 16,
      "stddev_ms": 16.863705,
      "timing": "hip_events",
      "warmup": 30,
      "wave_size": 32
    },
    {
      "activation": "gelu",
      "benchmark_kind": "integrated_paper_workload",
      "checksum": 0.00317980815,
      "comparable_to_paper": false,
      "compiled_target": "gfx1201",
      "compute_units": 32,
      "driver_version": 70253211,
      "feature_dim": 16,
      "git_sha": "db18b55d",
      "gpu_name": "AMD Radeon Graphics",
      "grid_height": 1024,
      "grid_width": 1024,
      "hidden_dim": 64,
      "hidden_layers": 3,
      "implementation": "fused_rocwmma_fp16",
      "isa": "gfx1201",
      "iters": 100,
      "max_ms": 48.699223,
      "mean_ms": 42.430275,
      "median_ms": 48.200451,
      "method": "grid-peps-3f",
      "min_ms": 17.344534,
      "mode": "peps",
      "num_frequencies": 3,
      "out_dim": 3,
      "output_height": 1024,
      "output_width": 1024,
      "p95_ms": 48.597263,
      "paper_reference_ms": 5.47,
      "paper_reference_source": "arXiv:2604.24167v1",
      "precision": "fp16_fp32_accumulate",
      "runtime_version": 70253211,
      "schema_version": 3,
      "selected_feature_dim": 112,
      "stddev_ms": 10.301837,
      "timing": "hip_events",
      "warmup": 30,
      "wave_size": 32
    },
    {